<?xml version="1.0" encoding="utf-8"?>
<!DOCTYPE HarvestMan SYSTEM "HarvestMan.dtd">
<HarvestMan>
	<config version="3.0" xmlversion="1.0">

		<project>
			<url>www.python.org/doc/current/tut/tut.html</url>
			<name>pytut</name>
			<basedir>~/websites</basedir>
			<verbosity value="2"/>
			<timeout value="300.0"/>
		</project>

		<network>
			<proxy>
				<proxyserver></proxyserver>
				<proxyuser></proxyuser>
				<proxypasswd></proxypasswd>
				<proxyport value="0"/>
			</proxy>
			<urlserver status="0">
				<urlhost>localhost</urlhost>
				<urlport value="3081"/>
			</urlserver>
		</network>

		<download>
			<types>
				<html value="1"/>
				<images value="1"/>
				<javascript value="1"/>
				<javaapplet value="1"/>
				<forms value="1"/>
				<cookies value="1"/>
			</types>
			<cache status="1">
				<datacache value="1"/>
			</cache>
			<misc>
				<retries value="1"/>
				<tidyhtml value="0"/>
			</misc>
		</download>

		<control>
			<links>
				<imagelinks value="1"/>
				<stylesheetlinks value="1"/>
			</links>
			<extent>
				<fetchlevel value="0"/>
				<extserverlinks value="0"/>
				<extpagelinks value="1"/>
				<depth value="10"/>
				<extdepth value="0"/>
				<subdomain value="0"/>
			</extent>
			<limits>
				<maxextservers value="0"/>
				<maxextdirs value="0"/>
				<maxfiles value="5000"/>
				<maxfilesize value="1048576"/>
				<connections value="5"/>
				<requests value="5"/>
				<timelimit value="-1"/>
			</limits>
			<rules>
				<robots value="1"/>
				<urlpriority></urlpriority>
				<serverpriority></serverpriority>
			</rules>
			<filters>
				<urlfilter></urlfilter>
				<serverfilter></serverfilter>
				<wordfilter></wordfilter>
				<junkfilter value="1"/>
			</filters>
		</control>

		<system>
			<workers status="1" size="10" timeout="200.0"/>
			<trackers value="4"/>
			<locale>american</locale>
			<fastmode value="1"/>
		</system>

		<files>
			<urllistfile></urllistfile>
			<urltreefile></urltreefile>
		</files>

		<indexer>
			<localise value="2"/>
		</indexer>
		<display>
			<browsepage value="1"/>
		</display>

	</config>

</HarvestMan>
